{
  "veduta": "project/1",
  "name": "game",
  "engine": "v1.4.1",
  "entry": "./cmd/game",
  "resolution": [320, 240],
  "inspect_resolution": [320, 240],
  "tick_rate": 20,
  "default_scene": "main",
  "default_seed": 1,
  "assets": "assets",
  "cooked": "assets/.cooked",
  "invariants": ["finite_positions"]
}
