{
  "veduta": "project/1",
  "name": "demo",
  "engine": "v0.2.0",
  "entry": "./cmd/game",
  "resolution": [320, 240],
  "inspect_resolution": [320, 240],
  "tick_rate": 20,
  "default_scene": "main",
  "default_seed": 1,
  "assets": "assets",
  "cooked": "assets/.cooked",
  "invariants": ["finite_positions", "within_bounds", "score_non_negative"],
  "bounds": [[-100, -50, -100], [100, 100, 100]]
}
