{
  "veduta": "project/1",
  "name": "mygame",
  "engine": "v0.1.0",
  "entry": "./cmd/game",
  "resolution": [1280, 720],
  "inspect_resolution": [640, 360],
  "tick_rate": 60,
  "default_scene": "main",
  "default_seed": 1,
  "assets": "assets",
  "cooked": "assets/.cooked",
  "invariants": ["finite_positions", "within_bounds"],
  "bounds": [[-100, -50, -100], [100, 100, 100]]
}
